{
  "$schema": "https://json-schema.org/draft/2020-12/schema",
  "$id": "https://schemas.multyr.finance/strategy-metadata/1.0/strategy-metadata.schema.json",
  "title": "Multyr Strategy Metadata (static)",
  "description": "Versioned, STATIC-only descriptive metadata for a Multyr strategy. This document MUST NOT contain runtime/dynamic values (APY, APR, TVL, AUM, capacity, utilization, current allocations/weights, share price, holder counts, volumes). Those are served by the runtime metrics API and keyed to this document by `id`. This document MUST NOT contain a risk rating, risk score, risk grade, or a safety/quality label (\"low risk\", \"safe\", \"conservative\", ...) until a formal Multyr risk-rating methodology is published and given its own schema version.",
  "type": "object",
  "additionalProperties": false,
  "required": [
    "schemaVersion",
    "id",
    "slug",
    "name",
    "tagline",
    "description",
    "category",
    "asset",
    "network",
    "principalGuaranteed",
    "yieldVariable",
    "protocols"
  ],
  "properties": {
    "schemaVersion": {
      "type": "string",
      "const": "1.0",
      "description": "Version of THIS schema that the document targets. The validator selects the schema file whose declared version matches."
    },
    "id": {
      "type": "string",
      "pattern": "^multyr-[a-z0-9]+(?:-[a-z0-9]+)*$",
      "maxLength": 64,
      "description": "Globally unique, permanently stable strategy identifier. Convention: 'multyr-' + slug. This is the join key for the runtime metrics API."
    },
    "slug": {
      "type": "string",
      "pattern": "^[a-z0-9]+(?:-[a-z0-9]+)*$",
      "maxLength": 48,
      "description": "URL-safe short name, unique per network. The metadata file MUST be named '<slug>.json'."
    },
    "name": {
      "type": "string",
      "minLength": 1,
      "maxLength": 80,
      "description": "Human-readable product name. Should match the on-chain strategy `name()` constant where one exists."
    },
    "symbol": {
      "type": "string",
      "minLength": 1,
      "maxLength": 16,
      "description": "Optional. Ticker of the share/receipt token users hold, when distinct from the deposit asset (e.g. the ERC-4626 vault share symbol)."
    },
    "tagline": {
      "type": "string",
      "minLength": 1,
      "maxLength": 160,
      "description": "One-line positioning statement. No performance claims, no risk/safety labels."
    },
    "description": {
      "type": "string",
      "minLength": 1,
      "maxLength": 800,
      "description": "Short paragraph describing what the strategy does and how. No performance claims, no risk/safety labels, no dynamic figures."
    },
    "category": {
      "type": "string",
      "description": "Primary taxonomy bucket.",
      "enum": [
        "lending",
        "money-market",
        "yield-aggregator",
        "liquidity-provision",
        "staking",
        "restaking",
        "delta-neutral",
        "basis-trade",
        "fixed-maturity",
        "structured",
        "rwa",
        "other"
      ]
    },
    "type": {
      "type": "string",
      "pattern": "^[a-z0-9]+(?:-[a-z0-9]+)*$",
      "maxLength": 48,
      "description": "Optional finer-grained sub-type within the category, e.g. 'multi-market-lending'."
    },
    "allocationModel": {
      "type": "string",
      "enum": [
        "single-venue",
        "static-weighted",
        "dynamic-rule-based",
        "discretionary",
        "index"
      ]
    },
    "management": {
      "type": "string",
      "enum": ["automated", "semi-automated", "manual"]
    },
    "yieldSource": {
      "type": "array",
      "minItems": 1,
      "uniqueItems": true,
      "items": {
        "type": "string",
        "enum": [
          "lending-interest",
          "trading-fees",
          "funding-rate",
          "staking-rewards",
          "token-incentives",
          "points",
          "mev",
          "basis"
        ]
      }
    },
    "asset": {
      "type": "object",
      "additionalProperties": false,
      "required": ["symbol", "depositAsset", "accountingAsset"],
      "properties": {
        "symbol": { "type": "string", "minLength": 1, "maxLength": 16, "description": "Primary asset the strategy is denominated in." },
        "depositAsset": { "type": "string", "minLength": 1, "maxLength": 16, "description": "Asset users deposit." },
        "accountingAsset": { "type": "string", "minLength": 1, "maxLength": 16, "description": "Asset NAV / share price is denominated in." },
        "class": { "type": "string", "enum": ["stablecoin", "eth", "btc", "altcoin", "lp", "other"] }
      }
    },
    "network": {
      "type": "object",
      "additionalProperties": false,
      "required": ["name", "chainId"],
      "properties": {
        "name": { "type": "string", "minLength": 1, "maxLength": 48 },
        "chainId": { "type": "integer", "minimum": 1 }
      }
    },
    "principalGuaranteed": {
      "type": "boolean",
      "description": "Whether principal is contractually guaranteed. For DeFi strategies this is effectively always false."
    },
    "yieldVariable": {
      "type": "boolean",
      "description": "Whether the yield is variable / not fixed."
    },
    "protocols": {
      "type": "array",
      "minItems": 1,
      "uniqueItems": true,
      "items": { "type": "string", "minLength": 1, "maxLength": 48 },
      "description": "Eligible external protocols the strategy MAY allocate to. This is an eligibility set only — it is NOT a current-allocation list and carries no weights."
    },
    "anchorProtocols": {
      "type": "array",
      "uniqueItems": true,
      "items": { "type": "string", "minLength": 1, "maxLength": 48 },
      "description": "Optional. Subset of `protocols` designated as primary/anchor venues by the strategy design. Descriptive only; not enforced by this document."
    },
    "objective": {
      "type": "object",
      "additionalProperties": false,
      "required": ["primary"],
      "properties": {
        "primary": { "type": "string", "minLength": 1, "maxLength": 400 },
        "optimizationTarget": { "type": "string", "minLength": 1, "maxLength": 120 }
      }
    },
    "allocation": {
      "type": "object",
      "additionalProperties": false,
      "description": "Description of the allocation POLICY. Must not contain concrete allocations, weights, or amounts.",
      "properties": {
        "dynamic": { "type": "boolean" },
        "ruleBased": { "type": "boolean" },
        "rebalancing": { "type": "string", "enum": ["automated", "manual", "none"] },
        "idleCapitalDeployment": { "type": "boolean" },
        "criteria": {
          "type": "array",
          "uniqueItems": true,
          "items": { "type": "string", "minLength": 1, "maxLength": 48 },
          "description": "Named inputs the allocation rules evaluate (e.g. 'yield', 'liquidity', 'capacity', 'protocol-risk')."
        }
      }
    },
    "riskControls": {
      "type": "array",
      "uniqueItems": true,
      "items": { "type": "string", "minLength": 1, "maxLength": 80 },
      "description": "Named risk-control MECHANISMS present in the strategy (e.g. 'per-adapter exposure caps', 'adapter quarantine'). Mechanism names only — never a score, rating, or grade."
    },
    "riskFactors": {
      "type": "array",
      "uniqueItems": true,
      "items": {
        "type": "string",
        "enum": [
          "smart-contract",
          "protocol",
          "counterparty",
          "stablecoin-depeg",
          "liquidity",
          "oracle",
          "governance",
          "market",
          "adapter",
          "bridge",
          "regulatory",
          "key-management"
        ]
      },
      "description": "Categories of risk the strategy is exposed to. This is an unordered set of factor labels, NOT a severity assessment."
    },
    "disclosures": {
      "type": "object",
      "additionalProperties": false,
      "properties": {
        "yieldVariable": { "type": "boolean" },
        "apyGuaranteed": { "type": "boolean" },
        "principalGuaranteed": { "type": "boolean" },
        "withdrawalLiquidityGuaranteed": { "type": "boolean" },
        "strategyCanReallocate": { "type": "boolean" }
      }
    },
    "links": {
      "type": "object",
      "additionalProperties": false,
      "properties": {
        "website": { "type": "string", "format": "uri", "pattern": "^https://" },
        "docs": { "type": "string", "format": "uri", "pattern": "^https://" },
        "terms": { "type": "string", "format": "uri", "pattern": "^https://" },
        "audits": {
          "type": "array",
          "uniqueItems": true,
          "items": { "type": "string", "format": "uri", "pattern": "^https://" }
        }
      }
    },
    "status": {
      "type": "object",
      "additionalProperties": false,
      "required": ["lifecycle"],
      "properties": {
        "lifecycle": {
          "type": "string",
          "enum": [
            "development",
            "audit",
            "testnet",
            "mainnet-beta",
            "mainnet",
            "paused",
            "deprecated"
          ]
        }
      }
    },
    "tags": {
      "type": "array",
      "uniqueItems": true,
      "items": { "type": "string", "pattern": "^[a-z0-9]+(?:-[a-z0-9]+)*$", "maxLength": 32 }
    }
  }
}
